{
  "$schema": "http://json-schema.org/draft-07/schema#",
  "title": "CognitiveEcosystemMessage",
  "type": "object",
  "required": [
    "id",
    "timestamp",
    "from_world",
    "to_world",
    "channel",
    "type",
    "payload",
    "auth"
  ],
  "properties": {
    "id": {
      "type": "string",
      "description": "Client generated ULID/UUID"
    },
    "timestamp": {
      "type": "number",
      "description": "Unix epoch seconds"
    },
    "from_world": {
      "type": "string"
    },
    "to_world": {
      "type": "string"
    },
    "channel": {
      "type": "string",
      "description": "Topic / capability lane"
    },
    "priority": {
      "type": "integer",
      "minimum": 0,
      "maximum": 9,
      "default": 5
    },
    "type": {
      "type": "string",
      "description": "event|task|ack|error"
    },
    "correlation_id": {
      "type": "string"
    },
    "payload": {
      "type": "object"
    },
    "ontology_version": {
      "type": "string"
    },
    "ack_required": {
      "type": "boolean",
      "default": true
    },
    "ttl_seconds": {
      "type": "integer",
      "minimum": 1,
      "maximum": 3600
    },
    "route_trace": {
      "type": "array",
      "items": {
        "type": "string"
      }
    },
    "auth": {
      "type": "object",
      "required": [
        "signature",
        "nonce"
      ],
      "properties": {
        "signature": {
          "type": "string"
        },
        "nonce": {
          "type": "string"
        },
        "key_id": {
          "type": "string"
        }
      }
    }
  },
  "additionalProperties": false
}